{
  "$schema": "https://json-schema.org/draft/2020-12/schema",
  "title": "IDP Final Line Transcription Response",
  "description": "Human-reviewed transcription output (schema_version 2)",
  "type": "object",
  "additionalProperties": false,
  "required": ["schema_version", "lines", "confidence_score", "confidence_label", "review_complete"],
  "properties": {
    "schema_version": {
      "type": "integer",
      "const": 2
    },
    "lines": {
      "type": "array",
      "items": {
        "type": "object",
        "additionalProperties": false,
        "required": ["page_number", "text", "line_box"],
        "properties": {
          "page_number": {
            "type": "integer",
            "minimum": 1
          },
          "text": {
            "type": "string"
          },
          "line_box": {
            "type": "object",
            "additionalProperties": false,
            "required": ["ymin", "xmin", "ymax", "xmax"],
            "properties": {
              "ymin": {
                "type": "integer",
                "minimum": 0,
                "maximum": 1000
              },
              "xmin": {
                "type": "integer",
                "minimum": 0,
                "maximum": 1000
              },
              "ymax": {
                "type": "integer",
                "minimum": 0,
                "maximum": 1000
              },
              "xmax": {
                "type": "integer",
                "minimum": 0,
                "maximum": 1000
              }
            }
          },
          "ai_confidence_label": {
            "type": "string",
            "enum": ["low", "medium", "high"]
          },
          "ai_notes": {
            "type": "string"
          },
          "reviewer_confidence_label": {
            "type": "string",
            "enum": ["low", "medium", "high"]
          },
          "reviewer_notes": {
            "type": "string"
          },
          "reviewer_changed": {
            "type": "boolean"
          },
          "excluded": {
            "type": "boolean"
          }
        }
      }
    },
    "confidence_score": {
      "type": "number",
      "minimum": 0,
      "maximum": 1
    },
    "confidence_label": {
      "type": "string",
      "enum": ["low", "medium", "high"]
    },
    "review_complete": {
      "type": "boolean"
    },
    "model": {
      "type": "string"
    },
    "configuration": {
      "type": "string"
    }
  },
  "allOf": [
    {
      "if": {
        "properties": {
          "lines": {
            "type": "array",
            "contains": {
              "type": "object",
              "properties": {
                "ai_confidence_label": {
                  "const": "low"
                }
              },
              "required": ["ai_confidence_label"]
            }
          }
        }
      },
      "then": {
        "properties": {
          "lines": {
            "type": "array",
            "items": {
              "if": {
                "properties": {
                  "ai_confidence_label": {
                    "const": "low"
                  }
                },
                "required": ["ai_confidence_label"]
              },
              "then": {
                "required": ["ai_notes"],
                "properties": {
                  "ai_notes": {
                    "minLength": 1
                  }
                }
              }
            }
          }
        }
      }
    }
  ]
}
