{
  "schema_version": 2,
  "lines": [
    {
      "page_number": 1,
      "text": "== THE PREFACE.",
      "ai_confidence_label": "high",
      "ai_notes": "",
      "line_box": {
        "ymin": 247,
        "xmin": 198,
        "ymax": 295,
        "xmax": 809
      },
      "reviewer_changed": false,
      "reviewer_notes": ""
    },
    {
      "page_number": 1,
      "text": "In the First Part were explained Fifteen Chapters of",
      "ai_confidence_label": "high",
      "ai_notes": "",
      "line_box": {
        "ymin": 334,
        "xmin": 238,
        "ymax": 367,
        "xmax": 811
      },
      "reviewer_changed": false,
      "reviewer_notes": ""
    },
    {
      "page_number": 1,
      "text": "Genesis, and those Things which they contain in an Internal",
      "ai_confidence_label": "high",
      "ai_notes": "",
      "line_box": {
        "ymin": 358,
        "xmin": 202,
        "ymax": 389,
        "xmax": 811
      },
      "reviewer_changed": false,
      "reviewer_notes": ""
    },
    {
      "page_number": 1,
      "text": "Sense; and to every Chapter were adjoined what, by",
      "ai_confidence_label": "high",
      "ai_notes": "",
      "line_box": {
        "ymin": 380,
        "xmin": 202,
        "ymax": 412,
        "xmax": 815
      },
      "reviewer_changed": false,
      "reviewer_notes": ""
    },
    {
      "page_number": 1,
      "text": "the Divine Mercy of the Lord, it was allowed me to see and",
      "ai_confidence_label": "high",
      "ai_notes": "",
      "line_box": {
        "ymin": 403,
        "xmin": 202,
        "ymax": 434,
        "xmax": 813
      },
      "reviewer_changed": false,
      "reviewer_notes": ""
    },
    {
      "page_number": 1,
      "text": "hear in the World of Spirits and in the Heaven of Angels.",
      "ai_confidence_label": "high",
      "ai_notes": "",
      "line_box": {
        "ymin": 426,
        "xmin": 203,
        "ymax": 456,
        "xmax": 813
      },
      "reviewer_changed": false,
      "reviewer_notes": ""
    },
    {
      "page_number": 1,
      "text": "Now follows the Next Part, in which, to every Chapter will,",
      "ai_confidence_label": "high",
      "ai_notes": "",
      "line_box": {
        "ymin": 449,
        "xmin": 200,
        "ymax": 480,
        "xmax": 818
      },
      "reviewer_changed": false,
      "reviewer_notes": ""
    },
    {
      "page_number": 1,
      "text": "in like Manner, be annexed Things of the same Nature; and",
      "ai_confidence_label": "high",
      "ai_notes": "",
      "line_box": {
        "ymin": 473,
        "xmin": 203,
        "ymax": 501,
        "xmax": 815
      },
      "reviewer_changed": false,
      "reviewer_notes": ""
    },
    {
      "page_number": 1,
      "text": "to this 16th Chapter those Things in the Word which relate",
      "ai_confidence_label": "high",
      "ai_notes": "",
      "line_box": {
        "ymin": 496,
        "xmin": 203,
        "ymax": 523,
        "xmax": 816
      },
      "reviewer_changed": false,
      "reviewer_notes": ""
    },
    {
      "page_number": 1,
      "text": "to Visions and Dreams, also to such as are Prophetical. _I_",
      "ai_confidence_label": "high",
      "ai_notes": "",
      "line_box": {
        "ymin": 518,
        "xmin": 204,
        "ymax": 545,
        "xmax": 816
      },
      "reviewer_changed": false,
      "reviewer_notes": ""
    },
    {
      "page_number": 1,
      "text": "know there are but few will believe, that it is possible for any one",
      "ai_confidence_label": "high",
      "ai_notes": "",
      "line_box": {
        "ymin": 539,
        "xmin": 205,
        "ymax": 568,
        "xmax": 816
      },
      "reviewer_changed": false,
      "reviewer_notes": ""
    },
    {
      "page_number": 1,
      "text": "to see those Things which are in the other Life, and from thence",
      "ai_confidence_label": "high",
      "ai_notes": "",
      "line_box": {
        "ymin": 562,
        "xmin": 204,
        "ymax": 591,
        "xmax": 818
      },
      "reviewer_changed": false,
      "reviewer_notes": ""
    },
    {
      "page_number": 1,
      "text": "be able to report any Thing concerning the State of Souls after",
      "ai_confidence_label": "high",
      "ai_notes": "",
      "line_box": {
        "ymin": 584,
        "xmin": 208,
        "ymax": 611,
        "xmax": 819
      },
      "reviewer_changed": false,
      "reviewer_notes": ""
    },
    {
      "page_number": 1,
      "text": "Death; because few believe the Resurrection, and indeed fewer",
      "ai_confidence_label": "high",
      "ai_notes": "",
      "line_box": {
        "ymin": 606,
        "xmin": 208,
        "ymax": 635,
        "xmax": 818
      },
      "reviewer_changed": false,
      "reviewer_notes": ""
    },
    {
      "page_number": 1,
      "text": "of the Learned than of the Simple. It's true, they verbally own,",
      "ai_confidence_label": "high",
      "ai_notes": "",
      "line_box": {
        "ymin": 628,
        "xmin": 205,
        "ymax": 658,
        "xmax": 822
      },
      "reviewer_changed": false,
      "reviewer_notes": ""
    },
    {
      "page_number": 1,
      "text": "because it is agreeable to the Doctrine of Faith, that they shall",
      "ai_confidence_label": "high",
      "ai_notes": "",
      "line_box": {
        "ymin": 653,
        "xmin": 208,
        "ymax": 680,
        "xmax": 819
      },
      "reviewer_changed": false,
      "reviewer_notes": ""
    },
    {
      "page_number": 1,
      "text": "rise again, but deny it in their Hearts. Nay, there are some",
      "ai_confidence_label": "high",
      "ai_notes": "",
      "line_box": {
        "ymin": 674,
        "xmin": 207,
        "ymax": 704,
        "xmax": 823
      },
      "reviewer_changed": false,
      "reviewer_notes": ""
    },
    {
      "page_number": 1,
      "text": "who openly confess, that then they will believe it, when any one",
      "ai_confidence_label": "high",
      "ai_notes": "",
      "line_box": {
        "ymin": 697,
        "xmin": 208,
        "ymax": 726,
        "xmax": 822
      },
      "reviewer_changed": false,
      "reviewer_notes": ""
    },
    {
      "page_number": 1,
      "text": "shall rise from the Dead, and they should see, hear and touch",
      "ai_confidence_label": "high",
      "ai_notes": "",
      "line_box": {
        "ymin": 721,
        "xmin": 207,
        "ymax": 747,
        "xmax": 820
      },
      "reviewer_changed": false,
      "reviewer_notes": ""
    },
    {
      "page_number": 1,
      "text": "him. But if this could be done, it might be done for the Satisfaction",
      "ai_confidence_label": "high",
      "ai_notes": "",
      "line_box": {
        "ymin": 742,
        "xmin": 208,
        "ymax": 774,
        "xmax": 820
      },
      "reviewer_changed": false,
      "reviewer_notes": ""
    },
    {
      "page_number": 1,
      "text": "of every one; and even then every such Person,",
      "ai_confidence_label": "high",
      "ai_notes": "",
      "line_box": {
        "ymin": 767,
        "xmin": 212,
        "ymax": 793,
        "xmax": 818
      },
      "reviewer_changed": false,
      "reviewer_notes": ""
    },
    {
      "page_number": 1,
      "text": "who denies it in his Heart, would not be so convinced,",
      "ai_confidence_label": "high",
      "ai_notes": "",
      "line_box": {
        "ymin": 787,
        "xmin": 211,
        "ymax": 817,
        "xmax": 820
      },
      "reviewer_changed": false,
      "reviewer_notes": ""
    },
    {
      "page_number": 1,
      "text": "but a thousand Objections would arise, which would render",
      "ai_confidence_label": "high",
      "ai_notes": "",
      "line_box": {
        "ymin": 813,
        "xmin": 214,
        "ymax": 836,
        "xmax": 819
      },
      "reviewer_changed": false,
      "reviewer_notes": ""
    },
    {
      "page_number": 1,
      "text": "his Mind obdurate in the Negative. Some even say they",
      "ai_confidence_label": "high",
      "ai_notes": "",
      "line_box": {
        "ymin": 832,
        "xmin": 212,
        "ymax": 863,
        "xmax": 819
      },
      "reviewer_changed": false,
      "reviewer_notes": ""
    },
    {
      "page_number": 1,
      "text": "believe that they shall rise again, but it will be in the Day",
      "ai_confidence_label": "high",
      "ai_notes": "",
      "line_box": {
        "ymin": 842,
        "xmin": 215,
        "ymax": 855,
        "xmax": 819
      },
      "reviewer_changed": false,
      "reviewer_notes": ""
    },
    {
      "page_number": 1,
      "text": "23181",
      "ai_confidence_label": "medium",
      "ai_notes": "Library stamp or manuscript marking included for completeness",
      "line_box": {
        "ymin": 896,
        "xmin": 474,
        "ymax": 919,
        "xmax": 567
      },
      "reviewer_changed": false,
      "reviewer_notes": ""
    },
    {
      "page_number": 2,
      "text": "of the _Last Judgment_, of which they have conceived an Opinion,",
      "ai_confidence_label": "high",
      "ai_notes": "",
      "line_box": {
        "ymin": 141,
        "xmin": 230,
        "ymax": 173,
        "xmax": 806
      },
      "reviewer_changed": false,
      "reviewer_notes": ""
    },
    {
      "page_number": 2,
      "text": "that then all Things which are in this visible World",
      "ai_confidence_label": "high",
      "ai_notes": "",
      "line_box": {
        "ymin": 164,
        "xmin": 227,
        "ymax": 195,
        "xmax": 811
      },
      "reviewer_changed": false,
      "reviewer_notes": ""
    },
    {
      "page_number": 2,
      "text": "shall perish; and because Men have, for many Ages, expected",
      "ai_confidence_label": "high",
      "ai_notes": "",
      "line_box": {
        "ymin": 186,
        "xmin": 227,
        "ymax": 220,
        "xmax": 810
      },
      "reviewer_changed": false,